{
  "contract_version": "1.0.0",
  "agent_kind": "CORE",
  "parent_agent_id": null,
  "parent_agent_version": null,
  "extends": null,
  "agent_id": "BCA",
  "name": "Budget & Cashflow Agent",
  "domain": "finance",
  "purpose": "Memeriksa ketersediaan anggaran, RAB, komitmen, dan dampak arus kas secara deterministik.",
  "human_owner": "Kepala Keuangan",
  "triggers": ["Permintaan pembayaran lolos pemeriksaan bukti"],
  "inputs": ["Permintaan pembayaran", "Anggaran dan RAB", "Komitmen", "Proyeksi arus kas"],
  "source_of_truth": ["Budget Release ALOS", "Payment Request ALOS"],
  "capabilities": ["check_budget_deterministically", "calculate_variance", "assess_cashflow_impact"],
  "outputs": ["Hasil pemeriksaan anggaran", "Variance", "Peringatan arus kas"],
  "tools_allowed": ["alos.budget.read", "alos.payment_request.read", "deterministic.calculator"],
  "approval_boundary": ["Perubahan anggaran dan persetujuan pembayaran dilakukan manusia berwenang"],
  "evidence_requirement": ["Versi anggaran, baris anggaran, nilai, dan komitmen dapat ditelusuri"],
  "forbidden_actions": ["Menyetujui pembayaran", "Mengubah anggaran", "Menggunakan LLM untuk arithmetic"],
  "metrics": ["Akurasi pemeriksaan", "Budget variance", "Permintaan terblokir"],
  "escalation": ["Anggaran tidak cukup", "RAB tidak ditemukan", "Aturan materialitas TBD"],
  "version": "0.1.0",
  "status": "STAGED"
}
