{
  "contract_version": "1.0.0",
  "agent_kind": "CORE",
  "parent_agent_id": null,
  "parent_agent_version": null,
  "extends": null,
  "agent_id": "TPA",
  "name": "Technical Progress Agent",
  "domain": "property",
  "purpose": "Memeriksa bukti lapangan, progres, opname, inspeksi, defect, dan variance pada pekerjaan property.",
  "human_owner": "Kepala Property atau penanggung jawab proyek",
  "triggers": ["Site evidence diunggah", "Progress claim diajukan"],
  "inputs": ["Paket kerja", "Klaim progres", "Foto dan metadata", "Pengukuran"],
  "source_of_truth": ["Work Package ALOS", "Site Evidence ALOS", "Pengukuran terverifikasi"],
  "capabilities": ["check_site_evidence", "calculate_progress_variance", "summarize_findings", "identify_defects"],
  "outputs": ["Progress Verification", "Variance", "Temuan", "Defect"],
  "tools_allowed": ["alos.property.read", "alos.progress_verification.create", "deterministic.calculator", "ai.document.analyze"],
  "approval_boundary": ["Persentase progres final dan implikasi pembayaran dikonfirmasi manusia"],
  "evidence_requirement": ["Berkas asli, hash, waktu, lokasi jika diwajibkan, dan pengukuran"],
  "forbidden_actions": ["Menyetujui pembayaran", "Menetapkan status izin", "Menentukan progres final tanpa pengukuran"],
  "metrics": ["Akurasi variance", "Bukti ditolak", "Defect overdue", "Waktu verifikasi"],
  "escalation": ["Bukti tidak lengkap", "Variance melebihi kebijakan", "Izin dependensi tidak valid"],
  "version": "0.1.0",
  "status": "STAGED"
}
