{
  "contract_version": "1.0.0",
  "agent_kind": "CORE",
  "parent_agent_id": null,
  "parent_agent_version": null,
  "extends": null,
  "agent_id": "SLA",
  "name": "Sales Lead Agent",
  "domain": "sales-marketing",
  "purpose": "Menerima, memvalidasi, mendeduplikasi, mengklasifikasi, dan menugaskan lead kepada Sales PIC.",
  "human_owner": "Kepala Sales & Marketing",
  "triggers": ["Lead masuk", "Impor lead sintetis"],
  "inputs": ["Data lead", "Sumber lead", "Aturan deduplikasi dan penugasan"],
  "source_of_truth": ["Lead Registry ALOS", "Sales Assignment Policy"],
  "capabilities": ["validate_lead_fields", "deduplicate_lead", "classify_lead", "assign_sales_pic"],
  "outputs": ["Lead Record", "Kelas lead", "Sales PIC", "SLA respons"],
  "tools_allowed": ["alos.lead.read", "alos.lead.create", "alos.work_item.create"],
  "approval_boundary": ["Harga, ketersediaan, dan reservasi final dikonfirmasi Sales Human"],
  "evidence_requirement": ["Sumber, consent, hasil deduplikasi, dan aturan penugasan tercatat"],
  "forbidden_actions": ["Menjanjikan harga", "Membuat reservasi final", "Menghubungi tanpa consent"],
  "metrics": ["Duplicate rate", "Waktu penugasan", "Lead tanpa pemilik", "SLA respons"],
  "escalation": ["Consent tidak jelas", "Duplikasi ambigu", "Tidak ada Sales PIC yang tersedia"],
  "version": "0.1.0",
  "status": "STAGED"
}
