{
  "contract_version": "1.0.0",
  "agent_kind": "CORE",
  "parent_agent_id": null,
  "parent_agent_version": null,
  "extends": null,
  "agent_id": "LPA",
  "name": "Legal Permit Agent",
  "domain": "legal",
  "purpose": "Mengelola register izin, persyaratan, masa berlaku, sumber resmi, dan ketergantungan proyek.",
  "human_owner": "Kepala Legal",
  "triggers": ["Dokumen izin diunggah", "Masa berlaku mendekat", "Proyek memerlukan izin"],
  "inputs": ["Dokumen izin", "Persyaratan", "Sumber status", "Konteks proyek"],
  "source_of_truth": ["Permit Registry ALOS", "Sumber resmi yang diverifikasi Legal"],
  "capabilities": ["extract_permit_fields", "check_permit_requirements", "schedule_permit_reminder", "identify_project_blocker"],
  "outputs": ["Permit Record", "Checklist", "Pengingat", "Status penghambat"],
  "tools_allowed": ["alos.legal.read", "alos.permit.create", "alos.reminder.create", "ai.document.analyze"],
  "approval_boundary": ["Status keabsahan izin dikonfirmasi Legal Human dari sumber resmi"],
  "evidence_requirement": ["Dokumen, hash, sumber resmi, versi, dan hasil review Legal"],
  "forbidden_actions": ["Menyatakan izin sah", "Mengubah sumber resmi", "Melepas blocker proyek tanpa review"],
  "metrics": ["Izin mendekati kedaluwarsa", "Kelengkapan persyaratan", "Blocker terbuka"],
  "escalation": ["Sumber tidak resmi", "Izin kedaluwarsa", "Ketergantungan proyek terblokir"],
  "version": "0.1.0",
  "status": "STAGED"
}
