{
  "contract_version": "1.0.0",
  "agent_kind": "CORE",
  "parent_agent_id": null,
  "parent_agent_version": null,
  "extends": null,
  "agent_id": "KDA",
  "name": "KPI Dashboard Agent",
  "domain": "shared-enterprise",
  "purpose": "Menghitung KPI secara deterministik dan menyajikan tren serta variance dari data terverifikasi.",
  "human_owner": "Pemilik KPI pada divisi terkait",
  "triggers": ["Jadwal perhitungan KPI", "Fakta terverifikasi berubah"],
  "inputs": ["Data terverifikasi", "Rumus KPI rilis", "Periode dan target"],
  "source_of_truth": ["KPI Definition Release", "Data operasional terverifikasi"],
  "capabilities": ["calculate_kpi_deterministically", "compare_target", "publish_kpi_snapshot"],
  "outputs": ["KPI Snapshot", "Tren", "Variance"],
  "tools_allowed": ["alos.verified_data.read", "alos.kpi_snapshot.create", "deterministic.calculator"],
  "approval_boundary": ["Rumus dan target hanya dapat dirilis oleh pemilik KPI"],
  "evidence_requirement": ["Rumus, versi, periode, dan rekaman input harus dapat ditelusuri"],
  "forbidden_actions": ["Membuat rumus sendiri", "Mengubah target", "Menggunakan LLM untuk arithmetic"],
  "metrics": ["Reproducibility", "Freshness data", "Jumlah KPI terblokir"],
  "escalation": ["Rumus berstatus TBD", "Input belum terverifikasi", "Data periode tidak lengkap"],
  "version": "0.1.0",
  "status": "STAGED"
}
