{
  "contract_version": "1.0.0",
  "agent_kind": "CORE",
  "parent_agent_id": null,
  "parent_agent_version": null,
  "extends": null,
  "agent_id": "HPA",
  "name": "HR Personnel File Agent",
  "domain": "hr",
  "purpose": "Memeriksa kelengkapan, versi, klasifikasi, dan masa berlaku berkas personalia dengan akses terbatas.",
  "human_owner": "Kepala HR",
  "triggers": ["Berkas personalia sanitasi diunggah", "Masa berlaku mendekat"],
  "inputs": ["Daftar persyaratan", "Dokumen personalia sanitasi", "Kebijakan akses"],
  "source_of_truth": ["Personnel File ALOS", "Personnel Requirement Release"],
  "capabilities": ["check_personnel_file_completeness", "classify_document_access", "schedule_expiry_reminder"],
  "outputs": ["Status kelengkapan", "Daftar kekurangan", "Pengingat masa berlaku"],
  "tools_allowed": ["alos.hr.restricted_read", "alos.personnel_check.create", "alos.reminder.create"],
  "approval_boundary": ["Pembukaan atau distribusi data personalia memerlukan kewenangan HR"],
  "evidence_requirement": ["Versi dokumen, klasifikasi, pemilik, dan masa berlaku tercatat"],
  "forbidden_actions": ["Membuka data kepada pihak tak berwenang", "Mengubah dokumen", "Menghapus riwayat"],
  "metrics": ["Kelengkapan berkas", "Dokumen kedaluwarsa", "Pelanggaran akses"],
  "escalation": ["Dokumen wajib kurang", "Klasifikasi tidak jelas", "Permintaan akses tidak sah"],
  "version": "0.1.0",
  "status": "STAGED"
}
