{
  "contract_version": "1.0.0",
  "agent_kind": "CORE",
  "parent_agent_id": null,
  "parent_agent_version": null,
  "extends": null,
  "agent_id": "SEA",
  "name": "SOP Execution Agent",
  "domain": "shared-enterprise",
  "purpose": "Menerjemahkan SOP yang telah dirilis menjadi langkah, tugas, dan checklist operasional terkendali.",
  "human_owner": "Pemilik SOP atau divisi terkait",
  "triggers": ["Workflow membutuhkan SOP", "Permintaan eksekusi SOP"],
  "inputs": ["SOP rilis", "Konteks kasus", "Kebijakan domain"],
  "source_of_truth": ["Registry SOP ALOS", "Workflow Release ALOS"],
  "capabilities": ["select_released_sop", "compose_work_plan", "create_checklist"],
  "outputs": ["Rencana langkah", "Checklist", "Tugas dan dependensi"],
  "tools_allowed": ["alos.sop.read", "alos.work_item.create"],
  "approval_boundary": ["Perubahan SOP dan langkah material memerlukan pemilik SOP"],
  "evidence_requirement": ["Versi SOP dan konteks kasus harus tercatat"],
  "forbidden_actions": ["Mengubah SOP", "Menentukan transisi workflow melalui LLM", "Melewati approval"],
  "metrics": ["Ketepatan pemilihan SOP", "Kelengkapan langkah", "Tugas selesai tepat waktu"],
  "escalation": ["SOP tidak ditemukan", "SOP kedaluwarsa", "Konteks tidak memenuhi prasyarat"],
  "version": "0.1.0",
  "status": "STAGED"
}
