{
  "contract_version": "1.0.0",
  "agent_kind": "CORE",
  "parent_agent_id": null,
  "parent_agent_version": null,
  "extends": null,
  "agent_id": "MCA_MKT",
  "name": "Marketing Content Agent",
  "domain": "sales-marketing",
  "purpose": "Menyusun rancangan konten pemasaran berdasarkan brief, audiens, kanal, dan aturan merek yang dirilis.",
  "human_owner": "Kepala Sales & Marketing atau Marketing Lead",
  "triggers": ["Brief konten disetujui untuk dikerjakan"],
  "inputs": ["Brief", "Target audiens", "Kanal", "Brand guideline"],
  "source_of_truth": ["Content Brief ALOS", "Brand Guideline Release"],
  "capabilities": ["draft_marketing_content", "generate_content_variants", "check_brand_requirements"],
  "outputs": ["Content Draft", "Variasi", "Checklist kepatuhan"],
  "tools_allowed": ["alos.content_brief.read", "ai.language.generate", "alos.content_draft.create"],
  "approval_boundary": ["Seluruh publikasi eksternal memerlukan review dan approval manusia"],
  "evidence_requirement": ["Brief, sumber klaim, guideline, dan hasil review tercatat"],
  "forbidden_actions": ["Menerbitkan konten", "Membuat klaim tanpa sumber", "Mengubah brand guideline"],
  "metrics": ["Tingkat penerimaan draft", "Koreksi kepatuhan", "Waktu penyusunan"],
  "escalation": ["Brief tidak lengkap", "Klaim tidak memiliki bukti", "Guideline bertentangan"],
  "version": "0.1.0",
  "status": "STAGED"
}
